SQL*Plus: Release 11.2.0.2.0 Production on Wed Nov 2 22:00:24 2022

Copyright (c) 1982, 2014, Oracle.  All rights reserved.

SQL> connect
Enter user-name: system
Enter password:
Connected.
SQL> select * from dept;

no rows selected

SQL> insert into DEPT values(&DEPTNO,'&DNAME','&LOC');
Enter value for deptno: 1
Enter value for dname: A
Enter value for loc: BANGLORE
old   1: insert into DEPT values(&DEPTNO,'&DNAME','&LOC')
new   1: insert into DEPT values(1,'A','BANGLORE')

1 row created.

SQL> /
Enter value for deptno: 2
Enter value for dname: B
Enter value for loc: HYDERABAD
old   1: insert into DEPT values(&DEPTNO,'&DNAME','&LOC')
new   1: insert into DEPT values(2,'B','HYDERABAD')

1 row created.

SQL> /
Enter value for deptno: 3
Enter value for dname: C
Enter value for loc: CHENNAI
old   1: insert into DEPT values(&DEPTNO,'&DNAME','&LOC')
new   1: insert into DEPT values(3,'C','CHENNAI')

1 row created.

SQL> 4
SP2-0226: Invalid line number
SQL> /
Enter value for deptno: 4
Enter value for dname: D
Enter value for loc: DELHI
old   1: insert into DEPT values(&DEPTNO,'&DNAME','&LOC')
new   1: insert into DEPT values(4,'D','DELHI')

1 row created.

SQL> /
Enter value for deptno: 5
Enter value for dname: E
Enter value for loc: MUMBAI
old   1: insert into DEPT values(&DEPTNO,'&DNAME','&LOC')
new   1: insert into DEPT values(5,'E','MUMBAI')

1 row created.

SQL> select * from DEPT;

    DEPTNO DNAME      LOC
---------- ---------- ----------
         1 A          BANGLORE
         2 B          HYDERABAD
         3 C          CHENNAI
         4 D          DELHI
         5 E          MUMBAI

SQL> create table emp1 as * from EMP
  2  ;
create table emp1 as * from EMP
                     *
ERROR at line 1:
ORA-00928: missing SELECT keyword


SQL> create table emp1 as EMPNO,ENAME,JOB,MGR,DEPTNO,SAL,COMMISSION,DOB from EMP;
create table emp1 as EMPNO,ENAME,JOB,MGR,DEPTNO,SAL,COMMISSION,DOB from EMP
                     *
ERROR at line 1:
ORA-00928: missing SELECT keyword


SQL> create table emp1 as EMPNO,ENAME,JOB,MGR,DEPTNO,SAL,COMMISSION,DOB from EMP
  2  create table emp1 as EMPNO,ENAME,JOB,MGR,DEPTNO,SAL,COMMISSION,DOB from EMP;
create table emp1 as EMPNO,ENAME,JOB,MGR,DEPTNO,SAL,COMMISSION,DOB from EMP
                     *
ERROR at line 1:
ORA-00928: missing SELECT keyword


SQL> create table EMP1 as select * from EMP;

Table created.

SQL> desc EMP1
 Name                                      Null?    Type
 ----------------------------------------- -------- ----------------------------
 EMPNO                                              NUMBER(6)
 ENAME                                              VARCHAR2(20)
 JOB                                                VARCHAR2(20)
 MGR                                                NUMBER(4)
 DEPTNO                                             NUMBER(3)
 SAL                                                NUMBER(7,2)
 COMMISSION                                         NUMBER(7,2)
 DOB                                                DATE

SQL> insert into EMP1 values(&EMPNO,'&ENAME','&JOB',&MGR,&DEPTNO,&SAL,&COMMISION,'&DOB');
Enter value for empno: 101
Enter value for ename: RAM
Enter value for job: A
Enter value for mgr: 50
Enter value for deptno: 1
Enter value for sal: 9000
Enter value for commision: 1000
Enter value for dob: 11-JULY-1993
old   1: insert into EMP1 values(&EMPNO,'&ENAME','&JOB',&MGR,&DEPTNO,&SAL,&COMMISION,'&DOB')
new   1: insert into EMP1 values(101,'RAM','A',50,1,9000,1000,'11-JULY-1993')

1 row created.

SQL> /
Enter value for empno: 102
Enter value for ename: RAJ
Enter value for job: B
Enter value for mgr: 52
Enter value for deptno: 2
Enter value for sal: 8000
Enter value for commision: 1000
Enter value for dob: 23-MAY-1995
old   1: insert into EMP1 values(&EMPNO,'&ENAME','&JOB',&MGR,&DEPTNO,&SAL,&COMMISION,'&DOB')
new   1: insert into EMP1 values(102,'RAJ','B',52,2,8000,1000,'23-MAY-1995')

1 row created.

SQL> select * from EMP;

no rows selected

SQL> select * from EMP1;

     EMPNO ENAME                JOB                         MGR     DEPTNO
---------- -------------------- -------------------- ---------- ----------
       SAL COMMISSION DOB
---------- ---------- ---------
       101 RAM                  A                            50          1
      9000       1000 11-JUL-93

       102 RAJ                  B                            52          2
      8000       1000 23-MAY-95


SQL> truncate table emp1;

Table truncated.

SQL> select * from EMP1;

no rows selected

SQL> drop table emp1;

Table dropped.

SQL> select * from EMP1;
select * from EMP1
              *
ERROR at line 1:
ORA-00942: table or view does not exist


SQL> insert into EMP values(&EMPNO,'&ENAME','&JOB',&MGR,&DEPTNO,&SAL,&COMMISION,'&DOB');
Enter value for empno: 7588
Enter value for ename: RAM
Enter value for job: A
Enter value for mgr: 50
Enter value for deptno: 1
Enter value for sal: 9000
Enter value for commision: 1000
Enter value for dob: 11-JULY-1993
old   1: insert into EMP values(&EMPNO,'&ENAME','&JOB',&MGR,&DEPTNO,&SAL,&COMMISION,'&DOB')
new   1: insert into EMP values(7588,'RAM','A',50,1,9000,1000,'11-JULY-1993')

1 row created.

SQL> /
Enter value for empno: RAJ
Enter value for ename:
Enter value for job:
Enter value for mgr:
Enter value for deptno:
Enter value for sal:
Enter value for commision:
Enter value for dob:
old   1: insert into EMP values(&EMPNO,'&ENAME','&JOB',&MGR,&DEPTNO,&SAL,&COMMISION,'&DOB')
new   1: insert into EMP values(RAJ,'','',,,,,'')
insert into EMP values(RAJ,'','',,,,,'')
                                 *
ERROR at line 1:
ORA-00936: missing expression


SQL> /
Enter value for empno: 7589
Enter value for ename: RAJ
Enter value for job: B
Enter value for mgr: 50
Enter value for deptno: 2
Enter value for sal: 8000
Enter value for commision: 1000
Enter value for dob: 23-MARCH-1995
old   1: insert into EMP values(&EMPNO,'&ENAME','&JOB',&MGR,&DEPTNO,&SAL,&COMMISION,'&DOB')
new   1: insert into EMP values(7589,'RAJ','B',50,2,8000,1000,'23-MARCH-1995')

1 row created.

SQL> /
Enter value for empno: 7590
Enter value for ename: SAM
Enter value for job: C
Enter value for mgr: 50
Enter value for deptno: 3
Enter value for sal: 8500
Enter value for commision: 1000
Enter value for dob: 15-AUGUST-1974
old   1: insert into EMP values(&EMPNO,'&ENAME','&JOB',&MGR,&DEPTNO,&SAL,&COMMISION,'&DOB')
new   1: insert into EMP values(7590,'SAM','C',50,3,8500,1000,'15-AUGUST-1974')

1 row created.

SQL> /
Enter value for empno: 7591
Enter value for ename: EVE
Enter value for job: D
Enter value for mgr: 50
Enter value for deptno: 4
Enter value for sal: 9500
Enter value for commision: 1000
Enter value for dob: 18-JANUARY-1984
old   1: insert into EMP values(&EMPNO,'&ENAME','&JOB',&MGR,&DEPTNO,&SAL,&COMMISION,'&DOB')
new   1: insert into EMP values(7591,'EVE','D',50,4,9500,1000,'18-JANUARY-1984')

1 row created.

SQL> /
Enter value for empno: 7599
Enter value for ename: RIA
Enter value for job: E
Enter value for mgr: 50
Enter value for deptno: 5
Enter value for sal: 9700
Enter value for commision: 1000
Enter value for dob: 04-APRIL-1992
old   1: insert into EMP values(&EMPNO,'&ENAME','&JOB',&MGR,&DEPTNO,&SAL,&COMMISION,'&DOB')
new   1: insert into EMP values(7599,'RIA','E',50,5,9700,1000,'04-APRIL-1992')

1 row created.

SQL> /
Enter value for empno: 7566
Enter value for ename: B=HEMA
Enter value for job: A
Enter value for mgr: 50
Enter value for deptno: 1
Enter value for sal: 9000
Enter value for commision: 1000
Enter value for dob: 07-FEBRUARY-1995
old   1: insert into EMP values(&EMPNO,'&ENAME','&JOB',&MGR,&DEPTNO,&SAL,&COMMISION,'&DOB')
new   1: insert into EMP values(7566,'B=HEMA','A',50,1,9000,1000,'07-FEBRUARY-1995')

1 row created.

SQL> /
Enter value for empno: 7565
Enter value for ename: MARY
Enter value for job: B
Enter value for mgr: 50
Enter value for deptno: 2
Enter value for sal: 9200
Enter value for commision: 1000
Enter value for dob: 06-OCTOBER-1995
old   1: insert into EMP values(&EMPNO,'&ENAME','&JOB',&MGR,&DEPTNO,&SAL,&COMMISION,'&DOB')
new   1: insert into EMP values(7565,'MARY','B',50,2,9200,1000,'06-OCTOBER-1995')

1 row created.

SQL> /
Enter value for empno: 7564
Enter value for ename: HENRY
Enter value for job: C
Enter value for mgr: 50
Enter value for deptno: 3
Enter value for sal: 8900
Enter value for commision: 1000
Enter value for dob: 19-MAY-1990
old   1: insert into EMP values(&EMPNO,'&ENAME','&JOB',&MGR,&DEPTNO,&SAL,&COMMISION,'&DOB')
new   1: insert into EMP values(7564,'HENRY','C',50,3,8900,1000,'19-MAY-1990')

1 row created.

SQL> /
Enter value for empno: 7563
Enter value for ename: TOM
Enter value for job: D
Enter value for mgr: 50
Enter value for deptno:
Enter value for sal:
Enter value for commision:
Enter value for dob:
old   1: insert into EMP values(&EMPNO,'&ENAME','&JOB',&MGR,&DEPTNO,&SAL,&COMMISION,'&DOB')
new   1: insert into EMP values(7563,'TOM','D',50,,,,'')
insert into EMP values(7563,'TOM','D',50,,,,'')
                                         *
ERROR at line 1:
ORA-00936: missing expression


SQL> /
Enter value for empno: 7563
Enter value for ename: TOM
Enter value for job: D
Enter value for mgr: 50
Enter value for deptno: 4
Enter value for sal: 8800
Enter value for commision: 1000
Enter value for dob: 05-NOVEMBER-1986
old   1: insert into EMP values(&EMPNO,'&ENAME','&JOB',&MGR,&DEPTNO,&SAL,&COMMISION,'&DOB')
new   1: insert into EMP values(7563,'TOM','D',50,4,8800,1000,'05-NOVEMBER-1986')

1 row created.

SQL> /
Enter value for empno: 7562
Enter value for ename: DANY
Enter value for job: E
Enter value for mgr: 50
Enter value for deptno: 5
Enter value for sal: 8700
Enter value for commision: 1000
Enter value for dob: 03-SEPTEMBER-1997
old   1: insert into EMP values(&EMPNO,'&ENAME','&JOB',&MGR,&DEPTNO,&SAL,&COMMISION,'&DOB')
new   1: insert into EMP values(7562,'DANY','E',50,5,8700,1000,'03-SEPTEMBER-1997')

1 row created.

SQL> /
Enter value for empno: 7561
Enter value for ename: PETER
Enter value for job: A
Enter value for mgr: 50
Enter value for deptno: 1
Enter value for sal: 8600
Enter value for commision: 1000
Enter value for dob: 09-JULY-1998
old   1: insert into EMP values(&EMPNO,'&ENAME','&JOB',&MGR,&DEPTNO,&SAL,&COMMISION,'&DOB')
new   1: insert into EMP values(7561,'PETER','A',50,1,8600,1000,'09-JULY-1998')

1 row created.

SQL> select * from EMP;

     EMPNO ENAME                JOB                         MGR     DEPTNO
---------- -------------------- -------------------- ---------- ----------
       SAL COMMISSION DOB
---------- ---------- ---------
      7588 RAM                  A                            50          1
      9000       1000 11-JUL-93

      7589 RAJ                  B                            50          2
      8000       1000 23-MAR-95

      7590 SAM                  C                            50          3
      8500       1000 15-AUG-74


     EMPNO ENAME                JOB                         MGR     DEPTNO
---------- -------------------- -------------------- ---------- ----------
       SAL COMMISSION DOB
---------- ---------- ---------
      7591 EVE                  D                            50          4
      9500       1000 18-JAN-84

      7599 RIA                  E                            50          5
      9700       1000 04-APR-92

      7566 B=HEMA               A                            50          1
      9000       1000 07-FEB-95


     EMPNO ENAME                JOB                         MGR     DEPTNO
---------- -------------------- -------------------- ---------- ----------
       SAL COMMISSION DOB
---------- ---------- ---------
      7565 MARY                 B                            50          2
      9200       1000 06-OCT-95

      7564 HENRY                C                            50          3
      8900       1000 19-MAY-90

      7563 TOM                  D                            50          4
      8800       1000 05-NOV-86


     EMPNO ENAME                JOB                         MGR     DEPTNO
---------- -------------------- -------------------- ---------- ----------
       SAL COMMISSION DOB
---------- ---------- ---------
      7562 DANY                 E                            50          5
      8700       1000 03-SEP-97

      7561 PETER                A                            50          1
      8600       1000 09-JUL-98


11 rows selected.

SQL> update EMP
  2  set COMMISSION=1000
  3  where JOB='C';

2 rows updated.

SQL> delete from EMP
  2  where JOB='D';

2 rows deleted.

SQL> select * from EMP;

     EMPNO ENAME                JOB                         MGR     DEPTNO
---------- -------------------- -------------------- ---------- ----------
       SAL COMMISSION DOB
---------- ---------- ---------
      7588 RAM                  A                            50          1
      9000       1000 11-JUL-93

      7589 RAJ                  B                            50          2
      8000       1000 23-MAR-95

      7590 SAM                  C                            50          3
      8500       1000 15-AUG-74


     EMPNO ENAME                JOB                         MGR     DEPTNO
---------- -------------------- -------------------- ---------- ----------
       SAL COMMISSION DOB
---------- ---------- ---------
      7599 RIA                  E                            50          5
      9700       1000 04-APR-92

      7566 B=HEMA               A                            50          1
      9000       1000 07-FEB-95

      7565 MARY                 B                            50          2
      9200       1000 06-OCT-95


     EMPNO ENAME                JOB                         MGR     DEPTNO
---------- -------------------- -------------------- ---------- ----------
       SAL COMMISSION DOB
---------- ---------- ---------
      7564 HENRY                C                            50          3
      8900       1000 19-MAY-90

      7562 DANY                 E                            50          5
      8700       1000 03-SEP-97

      7561 PETER                A                            50          1
      8600       1000 09-JUL-98


9 rows selected.

SQL> delete from EMP
  2  where EMPNO=7599;

1 row deleted.

SQL> select * from EMP;

     EMPNO ENAME                JOB                         MGR     DEPTNO
---------- -------------------- -------------------- ---------- ----------
       SAL COMMISSION DOB
---------- ---------- ---------
      7588 RAM                  A                            50          1
      9000       1000 11-JUL-93

      7589 RAJ                  B                            50          2
      8000       1000 23-MAR-95

      7590 SAM                  C                            50          3
      8500       1000 15-AUG-74


     EMPNO ENAME                JOB                         MGR     DEPTNO
---------- -------------------- -------------------- ---------- ----------
       SAL COMMISSION DOB
---------- ---------- ---------
      7566 B=HEMA               A                            50          1
      9000       1000 07-FEB-95

      7565 MARY                 B                            50          2
      9200       1000 06-OCT-95

      7564 HENRY                C                            50          3
      8900       1000 19-MAY-90


     EMPNO ENAME                JOB                         MGR     DEPTNO
---------- -------------------- -------------------- ---------- ----------
       SAL COMMISSION DOB
---------- ---------- ---------
      7562 DANY                 E                            50          5
      8700       1000 03-SEP-97

      7561 PETER                A                            50          1
      8600       1000 09-JUL-98


8 rows selected.
